{
  "schemaVersion": "1.0.0",
  "definitionId": "wd-marketing-ad-strategy-synthetic-m1",
  "title": "Advertising Strategy Operator — Synthetic M1 Fixture",
  "occupationCatalogId": "marketing-ad-strategy",
  "provenance": {
    "kind": "synthetic",
    "generatedAt": "2026-08-30T00:00:00Z",
    "sources": [
      {
        "id": "ev-prov-design",
        "status": "assumed",
        "sourceType": "synthetic",
        "sourceRef": "docs/workforce-compiler-m1-design.md",
        "claim": "M1 synthetic paid-acquisition occupation profile for Advertising Strategy Operator",
        "observedAt": null,
        "note": "Example values only; not claims about a real business."
      }
    ]
  },
  "businesses": [
    {
      "id": "biz-paid-acquisition-saas",
      "name": "Hypothetical B2B SaaS paid acquisition",
      "purpose": "Acquire qualified trial signups through paid media within a controlled weekly budget.",
      "targetCustomers": [
        "B2B SaaS founders evaluating paid acquisition",
        "Growth operators running search and social experiments"
      ],
      "valueProposition": "Turn ambiguous ad spend into a documented experiment portfolio with stop/continue gates.",
      "outcomeMetrics": [
        {
          "id": "metric-biz-qualified-trials",
          "name": "Qualified trial signups",
          "unit": "signups",
          "currentValue": null,
          "targetValue": 40,
          "deadline": "2026-09-30",
          "measurementMethod": "Count trial accounts that complete onboarding checklist within 7 days of first ad click attribution.",
          "successCondition": "Reach 40 qualified trials in September without exceeding the weekly budget ceiling.",
          "stopCondition": "Stop if blended CAC exceeds 1.5x target for two consecutive weeks with no learning gain.",
          "evidence": {
            "id": "ev-metric-biz-qualified-trials",
            "status": "assumed",
            "sourceType": "synthetic",
            "sourceRef": "fixture://biz-paid-acquisition-saas/outcome",
            "claim": "Synthetic September target of 40 qualified trials",
            "observedAt": null,
            "note": null
          }
        }
      ],
      "processIds": [
        "proc-strategy-experiment-design",
        "proc-measurement-optimization"
      ],
      "constraints": [
        "No real ad-account credentials or audience uploads in M1",
        "Budget figures are synthetic planning ranges, not spend authority",
        "External launch remains draft-only behind Human Approval"
      ],
      "evidence": [
        {
          "id": "ev-biz-scope",
          "status": "assumed",
          "sourceType": "synthetic",
          "sourceRef": "fixture://biz-paid-acquisition-saas",
          "claim": "Single synthetic paid-acquisition business for M1",
          "observedAt": null,
          "note": null
        }
      ]
    }
  ],
  "processes": [
    {
      "id": "proc-strategy-experiment-design",
      "businessId": "biz-paid-acquisition-saas",
      "name": "Strategy and experiment design",
      "purpose": "Assess platform fit and draft forecasted campaign experiments before any spend.",
      "trigger": "New offer, channel hypothesis, or monthly planning window opens.",
      "exitCondition": "Platform-fit note and draft campaign card are complete for Human review.",
      "kpis": [
        {
          "id": "metric-proc-design-throughput",
          "name": "Experiment drafts completed",
          "unit": "drafts",
          "currentValue": null,
          "targetValue": 4,
          "deadline": "2026-09-15",
          "measurementMethod": "Count accepted draft experiment cards with pessimistic/base/optimistic ranges.",
          "successCondition": "Four documented drafts ready for measurement review.",
          "stopCondition": "Stop drafting if channel hypotheses lack a measurable conversion event.",
          "evidence": {
            "id": "ev-metric-proc-design-throughput",
            "status": "assumed",
            "sourceType": "synthetic",
            "sourceRef": "fixture://proc-strategy-experiment-design/kpi",
            "claim": "Synthetic design throughput target",
            "observedAt": null,
            "note": null
          }
        }
      ],
      "taskIds": [
        "task-platform-fit-assessment",
        "task-forecast-campaign-draft"
      ],
      "dependsOnProcessIds": [],
      "evidence": [
        {
          "id": "ev-proc-design",
          "status": "assumed",
          "sourceType": "synthetic",
          "sourceRef": "fixture://proc-strategy-experiment-design",
          "claim": "Process covers platform fit and forecast draft work",
          "observedAt": null,
          "note": null
        }
      ]
    },
    {
      "id": "proc-measurement-optimization",
      "businessId": "biz-paid-acquisition-saas",
      "name": "Measurement and optimization",
      "purpose": "Confirm measurement readiness and recommend continue, change, or stop.",
      "trigger": "A draft experiment is ready or a weekly measurement window closes.",
      "exitCondition": "Measurement-readiness checklist and continue/change/stop recommendation exist.",
      "kpis": [
        {
          "id": "metric-proc-decision-latency",
          "name": "Decision latency",
          "unit": "days",
          "currentValue": null,
          "targetValue": 3,
          "deadline": "2026-09-30",
          "measurementMethod": "Days from measurement window close to documented recommendation.",
          "successCondition": "Median decision latency at or below 3 days.",
          "stopCondition": "Stop automation of recommendations if attribution gaps exceed policy.",
          "evidence": {
            "id": "ev-metric-proc-decision-latency",
            "status": "assumed",
            "sourceType": "synthetic",
            "sourceRef": "fixture://proc-measurement-optimization/kpi",
            "claim": "Synthetic decision latency target",
            "observedAt": null,
            "note": null
          }
        }
      ],
      "taskIds": [
        "task-measurement-readiness-review",
        "task-continue-change-stop-recommendation"
      ],
      "dependsOnProcessIds": ["proc-strategy-experiment-design"],
      "evidence": [
        {
          "id": "ev-proc-measurement",
          "status": "assumed",
          "sourceType": "synthetic",
          "sourceRef": "fixture://proc-measurement-optimization",
          "claim": "Process covers measurement readiness and optimization decisions",
          "observedAt": null,
          "note": null
        }
      ]
    }
  ],
  "tasks": [
    {
      "id": "task-platform-fit-assessment",
      "processId": "proc-strategy-experiment-design",
      "name": "Platform fit assessment",
      "purpose": "Decide whether a paid platform hypothesis is fit to draft an experiment.",
      "inputs": [
        "Offer positioning brief",
        "Audience hypothesis notes",
        "Historical synthetic CAC ranges"
      ],
      "outputs": [
        "Platform-fit memo with go/no-go",
        "Open measurement gaps list"
      ],
      "frequency": {
        "value": 2,
        "unit": "assessments",
        "period": "week",
        "evidence": {
          "id": "ev-task-platform-fit-frequency",
          "status": "assumed",
          "sourceType": "synthetic",
          "sourceRef": "fixture://task-platform-fit-assessment/frequency",
          "claim": "Assumed twice-weekly assessment cadence",
          "observedAt": null,
          "note": null
        }
      },
      "volume": {
        "value": 1,
        "unit": "platforms",
        "period": "event",
        "evidence": {
          "id": "ev-task-platform-fit-volume",
          "status": "assumed",
          "sourceType": "synthetic",
          "sourceRef": "fixture://task-platform-fit-assessment/volume",
          "claim": "One platform assessed per event",
          "observedAt": null,
          "note": null
        }
      },
      "requiredSkills": [
        {
          "skillId": "skill-unit-economics-analysis",
          "requiredLevel": 3,
          "rationale": "Need CAC/LTV framing to reject unfit platforms early."
        },
        {
          "skillId": "skill-experiment-design",
          "requiredLevel": 2,
          "rationale": "Assessment must leave a measurable hypothesis if it proceeds."
        }
      ],
      "risk": {
        "level": "low",
        "reasons": ["Read-only analysis with no external write"]
      },
      "authority": "draft",
      "approval": {
        "requiresHumanApproval": false,
        "state": "not_required",
        "actionType": "none",
        "target": null,
        "proposedDiff": null,
        "expectedResult": null,
        "downside": null,
        "rollback": null,
        "idempotencyKey": null
      },
      "currentOwner": "synthetic-operator",
      "currentTime": {
        "value": 90,
        "unit": "minutes",
        "period": "event",
        "evidence": {
          "id": "ev-task-platform-fit-time",
          "status": "assumed",
          "sourceType": "synthetic",
          "sourceRef": "fixture://task-platform-fit-assessment/time",
          "claim": "Assumed 90 minutes per assessment",
          "observedAt": null,
          "note": null
        }
      },
      "currentCost": {
        "amount": 0,
        "currency": "JPY",
        "period": "event",
        "evidence": {
          "id": "ev-task-platform-fit-cost",
          "status": "assumed",
          "sourceType": "synthetic",
          "sourceRef": "fixture://task-platform-fit-assessment/cost",
          "claim": "No media cost for assessment itself",
          "observedAt": null,
          "note": null
        }
      },
      "kpi": [
        {
          "id": "metric-task-platform-fit-completeness",
          "name": "Assessment completeness",
          "unit": "percent",
          "currentValue": null,
          "targetValue": 100,